{
  "id": "e2a1b3c4-d5e6-f7a8-b9c0-d1e2f3a4b5c6",
  "organization_id": "a1b2c3d4-e5f6-a7b8-c9d0-e1f2a3b4c5d6",
  "name": "Age Verification Trust Policy",
  "description": "Draft Cedar example for mDL age verification. Device-key proof and human presenter matching are separate controls.",
  "policy_type": "CREDENTIAL_VERIFICATION",
  "cedar_policies": [
    {
      "policy_id": "age-verify-permit-valid-mdl",
      "effect": "permit",
      "cedar_text": "@id(\"age-verify-permit-valid-mdl\")\npermit (\n    principal,\n    action == MIP::Action::\"credentials:verify\",\n    resource\n)\nwhen {\n    context.compliance_code == \"AAMVA_MDL\" &&\n    context.credential_format == \"MDOC\" &&\n    context.holder_binding_present &&\n    !context.is_revoked &&\n    !context.is_expired &&\n    context.issuer_trust_level >= 50\n};",
      "description": "Accept non-revoked, non-expired AAMVA mDL credentials with device authentication",
      "enabled": true
    },
    {
      "policy_id": "age-verify-deny-non-mdoc",
      "effect": "forbid",
      "cedar_text": "@id(\"age-verify-deny-non-mdoc\")\nforbid (\n    principal,\n    action == MIP::Action::\"credentials:verify\",\n    resource\n)\nwhen {\n    context.credential_format != \"MDOC\"\n};",
      "description": "Reject non-MDOC credentials for age verification",
      "enabled": true
    },
    {
      "policy_id": "age-verify-deny-no-holder-binding",
      "effect": "forbid",
      "cedar_text": "@id(\"age-verify-deny-no-holder-binding\")\nforbid (\n    principal,\n    action == MIP::Action::\"credentials:verify\",\n    resource\n)\nwhen {\n    !context.holder_binding_present\n};",
      "description": "Reject credentials without device authentication",
      "enabled": true
    },
    {
      "policy_id": "age-verify-deny-revoked",
      "effect": "forbid",
      "cedar_text": "@id(\"age-verify-deny-revoked\")\nforbid (\n    principal,\n    action == MIP::Action::\"credentials:verify\",\n    resource\n)\nwhen {\n    context.is_revoked\n};",
      "description": "Hard-fail on revoked credentials",
      "enabled": true
    }
  ],
  "cedar_schema_version": "MIP/1.0",
  "status": "DRAFT",
  "created_at": "2026-03-13T00:00:00Z",
  "updated_at": "2026-03-13T00:00:00Z"
}
